{
  "schemaVersion": 1,
  "enabled": false,
  "defaultWorkflow": "planning",
  "defaultAlias": "balanced",
  "databasePath": ".agent-kit/runtime/runtime.sqlite",
  "providers": {},
  "modelAliases": {},
  "agentRoutes": {},
  "agentExecutors": {},
  "mutationAgents": [
    "supabase-postgres-engineer",
    "nextjs-engineer",
    "frontend-design-lead",
    "marketing-copy-lead",
    "qa-engineer",
    "docs-maintainer",
    "deployment-observability-engineer"
  ],
  "cursor": {
    "enabled": false,
    "command": "cursor-agent",
    "args": ["--print", "--output-format", "stream-json", "--force"],
    "timeoutMs": 900000
  },
  "mcpServers": {},
  "sandbox": {
    "provider": "docker",
    "image": "node:22-bookworm-slim",
    "network": "none",
    "allowHostMutations": false,
    "timeoutMs": 600000,
    "memoryMb": 2048,
    "cpus": 2
  },
  "approvals": {
    "mode": "risk-tiered",
    "requirePlan": true,
    "requireFinalCommit": true
  },
  "limits": {
    "maxSteps": 24,
    "maxAgentVisits": 2,
    "maxRetriesPerNode": 2,
    "maxToolCallsPerAgent": 20,
    "runTimeoutMs": 3600000
  }
}
